[
  {
    "date": "1817-01-19",
    "date_precision": "day",
    "day_of_campaign": 0,
    "elevation_m": 706,
    "forces": [
      {
        "men": 3987,
        "note": "Estado general del 31-12-1816: 3.778 de tropa, 14 jefes y 195 oficiales; con milicianos y auxiliares, unos 5.000",
        "side": "Ejército de los Andes"
      }
    ],
    "id": "andes-01",
    "lat": -32.847,
    "lon": -68.807,
    "name": "El Plumerillo",
    "note": "Posición aproximada; la altitud es la del modelo de elevación en ese punto. 3.987 soldados (sin los 1.200 milicianos y arrieros); la columna de Los Patos era una parte del ejército.",
    "retrieved_at": "2026-10-08",
    "source": "UNCuyo, Historia virtual de Mendoza, «Cruce de los Andes»; Diario de Cuyo, «Crónica de una epopeya» (2017); Wikipedia, «Rutas sanmartinianas» y «Paso de Los Patos»; coordenadas: MapTiler Geocoding (OpenStreetMap) y lista oficial de pasos (argentina.gob.ar); altitud: MapTiler Terrain-RGB v2"
  },
  {
    "date": "1817-01-22",
    "date_precision": "approximate",
    "day_of_campaign": 3,
    "elevation_m": 1884,
    "forces": [
      {
        "men": 3987,
        "note": "Estado general del 31-12-1816: 3.778 de tropa, 14 jefes y 195 oficiales; con milicianos y auxiliares, unos 5.000",
        "side": "Ejército de los Andes"
      }
    ],
    "id": "andes-02",
    "lat": -32.591,
    "lon": -69.348,
    "name": "Valle de Uspallata",
    "note": "Posición aproximada; la altitud es la del modelo de elevación en ese punto.",
    "retrieved_at": "2026-10-08",
    "source": "UNCuyo, Historia virtual de Mendoza, «Cruce de los Andes»; Diario de Cuyo, «Crónica de una epopeya» (2017); Wikipedia, «Rutas sanmartinianas» y «Paso de Los Patos»; coordenadas: MapTiler Geocoding (OpenStreetMap) y lista oficial de pasos (argentina.gob.ar); altitud: MapTiler Terrain-RGB v2"
  },
  {
    "date": "1817-01-25",
    "date_precision": "approximate",
    "day_of_campaign": 6,
    "elevation_m": 1871,
    "forces": [
      {
        "men": 3987,
        "note": "Estado general del 31-12-1816: 3.778 de tropa, 14 jefes y 195 oficiales; con milicianos y auxiliares, unos 5.000",
        "side": "Ejército de los Andes"
      }
    ],
    "id": "andes-03",
    "lat": -31.85,
    "lon": -69.45,
    "name": "Valle de Calingasta",
    "note": "Posición aproximada; la altitud es la del modelo de elevación en ese punto.",
    "retrieved_at": "2026-10-08",
    "source": "UNCuyo, Historia virtual de Mendoza, «Cruce de los Andes»; Diario de Cuyo, «Crónica de una epopeya» (2017); Wikipedia, «Rutas sanmartinianas» y «Paso de Los Patos»; coordenadas: MapTiler Geocoding (OpenStreetMap) y lista oficial de pasos (argentina.gob.ar); altitud: MapTiler Terrain-RGB v2"
  },
  {
    "date": "1817-01-27",
    "date_precision": "approximate",
    "day_of_campaign": 8,
    "elevation_m": 1905,
    "forces": [
      {
        "men": 3987,
        "note": "Estado general del 31-12-1816: 3.778 de tropa, 14 jefes y 195 oficiales; con milicianos y auxiliares, unos 5.000",
        "side": "Ejército de los Andes"
      }
    ],
    "id": "andes-04",
    "lat": -31.903,
    "lon": -69.694,
    "name": "Río de los Patos",
    "note": "Posición aproximada; la altitud es la del modelo de elevación en ese punto.",
    "retrieved_at": "2026-10-08",
    "source": "UNCuyo, Historia virtual de Mendoza, «Cruce de los Andes»; Diario de Cuyo, «Crónica de una epopeya» (2017); Wikipedia, «Rutas sanmartinianas» y «Paso de Los Patos»; coordenadas: MapTiler Geocoding (OpenStreetMap) y lista oficial de pasos (argentina.gob.ar); altitud: MapTiler Terrain-RGB v2"
  },
  {
    "date": "1817-01-31",
    "date_precision": "day",
    "day_of_campaign": 12,
    "elevation_m": 2564,
    "forces": [
      {
        "men": 3987,
        "note": "Estado general del 31-12-1816: 3.778 de tropa, 14 jefes y 195 oficiales; con milicianos y auxiliares, unos 5.000",
        "side": "Ejército de los Andes"
      }
    ],
    "id": "andes-05",
    "lat": -31.92,
    "lon": -69.88,
    "name": "Manantiales",
    "note": "Posición aproximada; la altitud es la del modelo de elevación en ese punto.",
    "retrieved_at": "2026-10-08",
    "source": "UNCuyo, Historia virtual de Mendoza, «Cruce de los Andes»; Diario de Cuyo, «Crónica de una epopeya» (2017); Wikipedia, «Rutas sanmartinianas» y «Paso de Los Patos»; coordenadas: MapTiler Geocoding (OpenStreetMap) y lista oficial de pasos (argentina.gob.ar); altitud: MapTiler Terrain-RGB v2"
  },
  {
    "date": "1817-02-01",
    "date_precision": "approximate",
    "day_of_campaign": 13,
    "elevation_m": 3175,
    "forces": [
      {
        "men": 3987,
        "note": "Estado general del 31-12-1816: 3.778 de tropa, 14 jefes y 195 oficiales; con milicianos y auxiliares, unos 5.000",
        "side": "Ejército de los Andes"
      }
    ],
    "id": "andes-06",
    "lat": -32.084,
    "lon": -70.215,
    "name": "Campo del Mercedario",
    "note": "Posición aproximada; la altitud es la del modelo de elevación en ese punto.",
    "retrieved_at": "2026-10-08",
    "source": "UNCuyo, Historia virtual de Mendoza, «Cruce de los Andes»; Diario de Cuyo, «Crónica de una epopeya» (2017); Wikipedia, «Rutas sanmartinianas» y «Paso de Los Patos»; coordenadas: MapTiler Geocoding (OpenStreetMap) y lista oficial de pasos (argentina.gob.ar); altitud: MapTiler Terrain-RGB v2"
  },
  {
    "date": "1817-02-02",
    "date_precision": "day",
    "day_of_campaign": 14,
    "elevation_m": 3448,
    "forces": [
      {
        "men": 3987,
        "note": "Estado general del 31-12-1816: 3.778 de tropa, 14 jefes y 195 oficiales; con milicianos y auxiliares, unos 5.000",
        "side": "Ejército de los Andes"
      }
    ],
    "id": "andes-07",
    "lat": -32.15,
    "lon": -70.317,
    "name": "Paso de Las Llaretas",
    "note": "Posición aproximada; la altitud es la del modelo de elevación en ese punto.",
    "retrieved_at": "2026-10-08",
    "source": "UNCuyo, Historia virtual de Mendoza, «Cruce de los Andes»; Diario de Cuyo, «Crónica de una epopeya» (2017); Wikipedia, «Rutas sanmartinianas» y «Paso de Los Patos»; coordenadas: MapTiler Geocoding (OpenStreetMap) y lista oficial de pasos (argentina.gob.ar); altitud: MapTiler Terrain-RGB v2"
  },
  {
    "date": "1817-02-03",
    "date_precision": "approximate",
    "day_of_campaign": 15,
    "elevation_m": 3486,
    "forces": [
      {
        "men": 3987,
        "note": "Estado general del 31-12-1816: 3.778 de tropa, 14 jefes y 195 oficiales; con milicianos y auxiliares, unos 5.000",
        "side": "Ejército de los Andes"
      }
    ],
    "id": "andes-08",
    "lat": -32.363,
    "lon": -70.222,
    "name": "Valle Hermoso",
    "note": "Posición aproximada; la altitud es la del modelo de elevación en ese punto.",
    "retrieved_at": "2026-10-08",
    "source": "UNCuyo, Historia virtual de Mendoza, «Cruce de los Andes»; Diario de Cuyo, «Crónica de una epopeya» (2017); Wikipedia, «Rutas sanmartinianas» y «Paso de Los Patos»; coordenadas: MapTiler Geocoding (OpenStreetMap) y lista oficial de pasos (argentina.gob.ar); altitud: MapTiler Terrain-RGB v2"
  },
  {
    "date": "1817-02-04",
    "date_precision": "day",
    "day_of_campaign": 16,
    "elevation_m": 802,
    "forces": [
      {
        "men": 200,
        "note": "200 granaderos con el sargento mayor Antonio Arcos; el teniente Juan Lavalle llegó a tiempo con 25 granaderos",
        "side": "Ejército de los Andes (avanzada de Arcos)"
      },
      {
        "men": 100,
        "note": "más de 100 hombres de la guarnición de San Felipe, que atacaron a Arcos; fueron rechazados y dejaron Putaendo y San Felipe",
        "side": "Fuerzas realistas"
      }
    ],
    "id": "andes-09",
    "lat": -32.63,
    "lon": -70.713,
    "name": "Las Achupallas (combate)",
    "note": "Posición aproximada; la altitud es la del modelo de elevación en ese punto. Combate de la vanguardia, no de todo el ejército.",
    "outcome": {
      "place": "Valle de Putaendo",
      "result": "Victoria patriota",
      "sides": [
        {
          "killed": null,
          "note": "Las fuentes no dan las bajas",
          "prisoners": null,
          "side": "Ejército de los Andes",
          "units": "Granaderos a Caballo: la avanzada de Arcos y los 25 de Lavalle",
          "wounded": null
        },
        {
          "killed": null,
          "note": "Se retiraron y dejaron Putaendo y San Felipe; las fuentes no dan las bajas",
          "prisoners": null,
          "side": "Fuerzas realistas",
          "units": "Guarnición de San Felipe",
          "wounded": null
        }
      ],
      "summary": "La guarnición de San Felipe, con más de 100 hombres, atacó la avanzada del sargento mayor Antonio Arcos, de 200 granaderos. El teniente Juan Lavalle llegó a tiempo con 25 granaderos y los realistas se retiraron. Fue el primer triunfo de la campaña."
    },
    "retrieved_at": "2026-10-08",
    "source": "UNCuyo, Historia virtual de Mendoza, «Cruce de los Andes»; Diario de Cuyo, «Crónica de una epopeya» (2017); Wikipedia, «Rutas sanmartinianas» y «Paso de Los Patos»; coordenadas: MapTiler Geocoding (OpenStreetMap) y lista oficial de pasos (argentina.gob.ar); altitud: MapTiler Terrain-RGB v2"
  },
  {
    "date": "1817-02-07",
    "date_precision": "day",
    "day_of_campaign": 19,
    "elevation_m": 696,
    "forces": [
      {
        "men": 140,
        "note": "140 Granaderos a Caballo con Mariano Necochea (65 a 100 según otras fuentes)",
        "side": "Ejército de los Andes (vanguardia de Necochea)"
      },
      {
        "men": 700,
        "note": "unos 700 (400 de caballería y 300 de infantería, con 2 piezas) al mando de Miguel María de Atero; unos 30 muertos; se retiraron hacia Santiago",
        "side": "Fuerzas realistas"
      }
    ],
    "id": "andes-10",
    "lat": -32.691,
    "lon": -70.725,
    "name": "Las Coimas (combate)",